"","show_id","title","duration","listed_in","description"
"4148",80117746,"Blue Jay","81 min","Dramas, Independent Movies, Romantic Movies","Two former high school sweethearts unexpectedly reunite in their old hometown, where they rediscover their magical bond and face a shared regret."
"4149",80142615,"One in a Billion","70 min","Documentaries, Sports Movies","Follow the journey of Satnam Singh Bhamara as he works to fulfill his dream of becoming the first India-born player to be drafted into the NBA."
"4150",80115673,"Reggie Watts: Spatial","62 min","Music & Musicals, Stand-Up Comedy","The comic innovator delivers a surreal set blending experimental songs, jokes about grits, guns and drugs, and other improvised comedy adventures."
"4151",80105691,"The Model","104 min","Dramas, Independent Movies, International Movies","Danish teen Emma moves to Paris hoping to become a top model, but her dreams soon unravel when her affair with photographer Shane turns obsessive."
"4156",80244190,"Breath","116 min","Dramas, Sports Movies","In mid-1970s Australia, two small-town teenage boys befriend an enigmatic middle-aged surfer, who urges them to see the thrill in facing their fears."
"4159",80187435,"Craig Ferguson: Tickle Fight","67 min","Stand-Up Comedy","Cheeky comic Craig Ferguson keeps it casual as he discusses '70s porn, Japanese toilets and his mildly crime-filled days as a talk show host."
"4160",80104103,"The Good Neighbor","97 min","Dramas, Independent Movies, Thrillers","Two tech-savvy teens plot to fool a cranky old neighbor into believing his house is haunted, but their cruel prank soon takes some unexpected turns."
"4161",80004478,"Bill Burr: I'm Sorry You Feel That Way","81 min","Stand-Up Comedy","Bill Burr escapes the zombie apocalypse, explores how rom-coms ruin great sex and explains how too many childhood hugs may be the downfall of man."
"4162",81188871,"Let's Dance","109 min","Dramas, International Movies, Romantic Movies","After his crew breaks up, a gifted but insecure hip-hop dancer teaches at a top ballet school in Paris, where he falls for an aspiring ballerina."
"4165",80211590,"God's Not Dead: A Light in Darkness","106 min","Dramas, Faith & Spirituality","After a fire breaks out at his church, a pastor faces a legal battle against university leaders who wish to push the congregation off the campus."
"4167",80988989,"The Cakemaker","109 min","Dramas, Independent Movies, International Movies","When a German baker travels to Jerusalem in search of his dead male lover’s family, his growing involvement with them may expose his truth."
"4168",80117080,"Mercenary","99 min","Dramas, International Movies, Sports Movies","When he defies his cruel father and leaves New Caledonia to play rugby in France, young Soane learns hard lessons about life, love and success."
"4169",80042368,"A Very Murray Christmas","57 min","Comedies, Music & Musicals","Bill Murray rounds up an all-star cast for an evening of music, mischief and barroom camaraderie in this irreverent twist on holiday variety shows."
"4171",70211474,"Aarakshan","164 min","Dramas, International Movies","The decision by India's supreme court to establish caste-based reservations for jobs in education causes conflict between a teacher and his mentor."
"4173",81213876,"Adrishya","99 min","Horror Movies, Independent Movies, International Movies","A family’s harmonious existence is interrupted when the young son begins showing symptoms of anxiety that seem linked to disturbing events at home."
"4174",70056728,"Ahista Ahista","122 min","Dramas, International Movies, Romantic Movies","Stood up by her groom at the altar, a young woman finds help and healing from another man – until her ex-fiancé returns, hoping to win her back."
"4175",81161834,"Albert Pinto Ko Gussa Kyun Aata Hai?","85 min","Dramas, Independent Movies, International Movies","As the police investigate his disappearance, a young man heads to Goa to carry out an act of vengeance fueled by years of pent-up anger toward society."
"4176",247747,"Amar Akbar Anthony","172 min","Action & Adventure, Classic Movies, Comedies","Abandoned in a park by their father, Amar, Akbar and Anthony grow up independently and have no knowledge of one another. They're reunited as adults when, by coincidence, they all give blood at the same hospital."
"4177",70064205,"Anwar","134 min","Dramas, Independent Movies, International Movies","Seeking refuge in a Hindu temple after the tragic death of the girl he loved, a Muslim youth is caught by the police, who mistake him for an enemy."
"4179",80083672,"Barah Aana","95 min","Dramas, International Movies","After futile attempts to better their lives with honest work, three broke friends opt for a more dubious means of making money: kidnapping for ransom."
"4180",60003405,"Bawarchi","125 min","Classic Movies, Comedies, Dramas","A dysfunctional middle-class family is transformed by the attentions of their talented new chef – until he vanishes along with their valuable jewels."
"4181",70053010,"Bazaar","121 min","Dramas, Independent Movies, International Movies","A young man challenges traditional customs by standing up to the father of the woman he loves, who has promised her to a wealthy expatriate."
"4183",70062701,"Bhagam Bhag","151 min","Comedies, International Movies, Romantic Movies","A theater group lands in trouble when its new actress takes her own life, two of its members are framed for murder and no one is who they appear to be."
"4184",81213889,"Bhoot","114 min","Horror Movies, International Movies, Thrillers","After a couple moves into an apartment, the wife’s increasingly disturbing behavior unravels chilling secrets about their new home’s past."
"4185",70005055,"Bobby","168 min","Classic Movies, Dramas, International Movies","Raj, the son of strict, wealthy parents, falls in love with Bobby, the daughter of a poor Christian fisherman – a romance his parents oppose."
"4186",60029461,"Carrie","132 min","Horror Movies","This remake of the classic 1976 horror flick finds misfit Carrie getting revenge on all the cool people who've bullied her over the years."
"4187",81213893,"Chal Mere Bhai","132 min","Comedies, International Movies, Romantic Movies","When a secretary saves her tycoon boss's life, his family hears wedding bells. Problem is, she's already in love – with his younger brother."
"4188",372195,"Child's Play","87 min","Cult Movies, Horror Movies","When a rash of murders unfolds, 6-year-old Andy knows that his toy doll Chucky is the killer, but neither his mom nor the cops believe him."
"4189",20255593,"Chupke Chupke","127 min","Classic Movies, Comedies, International Movies","Jealous of the high regard in which his new wife holds their brother-in-law, a botany professor stages an elaborate prank that will even the score."
"4190",70059328,"Deadline: Sirf 24 Ghante","97 min","Independent Movies, International Movies, Thrillers","A surgeon’s perfect life is rattled when his daughter is taken hostage in their own home and he's given 24 hours to pay a hefty ransom."
"4191",81213888,"Dhamaal","128 min","Action & Adventure, Comedies, International Movies","Tipped off about buried money in Goa, four ne’er-do-well friends go on the hunt, chased by a police officer who wants the treasure for himself."
"4192",60024927,"Die Another Day","133 min","Action & Adventure","Pierce Brosnan's final outing as 007 finds James Bond facing off against a North Korean terrorist who's in league with a British diamond merchant."
"4193",20255837,"Don","158 min","Action & Adventure, Classic Movies, Dramas","A man who's a lookalike for a slain mob kingpin is asked by the police to impersonate the gangster and infiltrate his underworld organization."
"4194",70006866,"Encounter: The Killing","151 min","Dramas, Independent Movies, International Movies","After accidentally killing a young mobster, a guilt-stricken police officer searches for the parents who never came forward to claim their son's body."
"4195",20077944,"Ghayal","163 min","Action & Adventure, Dramas, International Movies","Framed for his older brother's murder, a boxer seeks violent revenge against the true killer who's torn his family apart."
"4196",20705133,"Ghulam-E-Musthafa","161 min","Action & Adventure, Dramas, International Movies","Giving up his life of crime for love, a gangster struggles with a moral dilemma when tragic events and enduring enemies take him back to the underworld."
"4197",21028086,"Gol Maal","137 min","Classic Movies, Comedies, International Movies","When circumstances at work compel Ram to pretend to have a twin, his lie works – until the boss wants his daughter to marry Ram’s fictitious brother."
"4198",22040803,"GoldenEye","130 min","Action & Adventure","Pierce Brosnan takes his first turn as debonair secret agent James Bond, who investigates the destruction of a Russian satellite weapons base."
"4199",70054380,"Golmaal: Fun Unlimited","148 min","Comedies, International Movies","Between thwarting crooks and wooing the belle next door, four pranksters get in over their heads when they bamboozle their way into a couple’s bungalow."
"4200",60020236,"Heartbreakers","124 min","Comedies, Romantic Movies","In this stylish comedy, a mother-daughter con team makes money the old-fashioned way: They use their feminine wiles to swindle it."
"4201",20765027,"Hera Pheri","156 min","Action & Adventure, Comedies, Dramas","The bond between two crooks and best friends is threatened when one learns that the other's father had a hand in his own tragic past."
"4202",81109078,"How High 2","89 min","Comedies","When a pair of friends uncover a weed Bible, their magical stash gets stolen, sending them on a pot-fueled quest through Atlanta to find it."
"4203",81213885,"Jaan-E-Mann: Let's Fall in Love... Again","163 min","Dramas, International Movies, Romantic Movies","To avoid alimony payments, an aspiring actor schemes for his ex-wife to marry an unlikely suitor, but soon realizes he may not be ready to lose her."
"4204",70129075,"Jail","132 min","Dramas, International Movies","Incarcerated for a crime he didn’t commit, a young man must navigate the crowded, cut-throat environment of prison as he awaits trial."
"4206",70295531,"John Day","125 min","International Movies, Thrillers","A bank manager and his wife, still grieving over their daughter who died in a fire, become pawns in a bank heist with ties to corruption and fraud."
"4207",17457622,"Judwaa","133 min","Comedies, International Movies, Romantic Movies","Separated at birth, a pair of identical twins unexpectedly reunite as adults and embark on a madcap mission to take down a common enemy from their past."
"4208",20712279,"Kaalia","173 min","Action & Adventure, Dramas, International Movies","Jailed for robbing his brother’s unscrupulous employer, a simpleton has a transformation while in prison, emerging with a violent mission for revenge."
"4209",70051840,"Katha","140 min","Comedies, Dramas, Independent Movies","Secretly in love with his neighbor, a mild-mannered clerk is heartbroken when his much bolder, more charming friend wins her heart instead."
"4210",81213895,"Khubsoorat","120 min","Classic Movies, Comedies, Dramas","A strict matriarch's regimented household is upended by the arrival of a spunky relative who challenges the rules."
"4211",24073896,"Koshish","115 min","International Movies, Romantic Movies","A speech and hearing-impaired couple persists through unforgiving obstacles to be accepted by society and live a life of dignity."
"4212",81221913,"Kuldip Patwal: I Didn't Do It!","126 min","Dramas, Independent Movies, International Movies","Accused of killing a politician, a local grocer’s fight to prove his innocence reveals his lifelong struggles with injustice leading up to the incident."
"4213",70040912,"Maine Pyaar Kyun Kiya","137 min","Comedies, International Movies, Music & Musicals","After lying to his girlfriend, orthopedic surgeon Samir must conjure up a pretend wife in this musical comedy."
"4214",81213979,"Masoom","138 min","Dramas, Independent Movies, International Movies","A loving husband and father's joyful family life is rocked to its core upon the discovery that he has a young son borne from a past extramarital affair."
"4215",70018445,"Mujhse Shaadi Karogi","158 min","Comedies, International Movies, Romantic Movies","Samir must overcome a hostile horoscope, a hot temper and a determined rival to win the heart of Rani, the love of his life."
"4216",81213897,"Namak Halaal","171 min","Action & Adventure, Comedies, International Movies","While loyally defending his boss from mobsters trying to kill him, a naive, hotel bellboy discovers the family he never knew he had."
"4218",81213882,"Phullu","96 min","Dramas, Independent Movies, International Movies","Struck by the lack of clean resources for menstruating women in his village, a jobless loafer braves social stigmas to create low-cost sanitary napkins."
"4221",81213896,"Rajnigandha","104 min","Comedies, Dramas, Independent Movies","A grad student leaves her boyfriend in Delhi for a job interview in Mumbai, where she reconnects with an old flame for whom she still has feelings."
"4222",60003097,"Ram Teri Ganga Maili","178 min","Classic Movies, Dramas, International Movies","Abandoned by her new husband and father of her son, a mountain woman journeys to Calcutta to find him, constantly tested by social evils along the way."
"4223",81213887,"Ramji Londonwaley","154 min","Comedies, Dramas, International Movies","A small-town cook moves to London to earn a living, but from his employer’s sudden death to the immigration officials on his trail, plans soon go sour."
"4224",896678,"Red Dawn","114 min","Action & Adventure, Cult Movies","A group of teenagers witnesses Soviet and Cuban paratroopers descending on their small Colorado town and systematically setting off World War III."
"4225",81217436,"Road to Sangam","136 min","Dramas, Independent Movies, International Movies","As communal violence erupts in his neighborhood, a Muslim mechanic presses forward to repair a historic truck that will transport Gandhi’s last remains."
"4226",81221914,"Saath Saath","118 min","Dramas, Independent Movies, International Movies","A young woman falls for her classmate’s idealistic, non-materialistic ways, but is troubled upon seeing his principles change after they marry."
"4227",70072558,"Sadma","137 min","Dramas, International Movies, Romantic Movies","After a traumatic injury leaves her with amnesia and age regression, a young woman is sold to a brothel before a teacher becomes her savior."
"4228",60002818,"Sangam","228 min","Classic Movies, Dramas, International Movies","Returning home from war after being assumed dead, a pilot weds the woman he has long loved, unaware that she had been planning to marry his best friend."
"4229",20257617,"Satte Pe Satta","153 min","Comedies, Cult Movies, Dramas","The eldest of seven brothers who run a family farm together marries a pretty nurse, inspiring his country-bumpkin siblings to follow his example."
"4230",70059284,"Shiva","168 min","Action & Adventure, Dramas, International Movies","A young man enrolls at a college and becomes a rival to the student-union president, who’s using force and intimidation to advance his criminal agenda."
"4231",60001404,"Swami","123 min","Dramas, Independent Movies, International Movies","After she enters into an arranged marriage, a spirited and intellectual young woman tries to adjust to life with a man who was not her choice."
"4232",81213879,"The Dark Side of Life: Mumbai City","121 min","Dramas, International Movies","Struggling with Mumbai's pressures and private battles with depression, six lives intersect just as they reach a breaking point."
"4233",81213898,"The Great Gambler","161 min","Action & Adventure, Classic Movies, Cult Movies","After unwittingly using his skills to obtain military secrets, a gambler is pursued by a police officer who happens to be his doppelgänger."
"4235",28371873,"The World Is Not Enough","128 min","Action & Adventure","Greed, revenge, world domination: It's all in a day's work for James Bond, who's on a mission to protect an oil heiress from a notorious terrorist."
"4236",17016471,"Tomorrow Never Dies","119 min","Action & Adventure","Pierce Brosnan stars in this 007 installment, which teams the secret agent and a sexy Chinese superspy against a megalomaniacal media mogul."
"4237",70065255,"Traffic Signal","130 min","Dramas, Independent Movies, International Movies","Four characters coexist at an urban traffic signal, where all manage to make a meager living until events threaten the source of their livelihood."
"4238",60021548,"Trikal (Past, Present, Future)","134 min","Comedies, Dramas, Independent Movies","A Goan native returns to his now-derelict, palatial childhood home, recalling his family’s interpersonal drama during the end of Portuguese rule."
"4239",81217438,"Union Leader","105 min","Dramas, Independent Movies, International Movies","Toxic conditions and a corrupt union leader prompt a chemical plant worker and earnest family man to fight for justice for his fellow laborers."
"4240",81213873,"Veerey Ki Wedding","130 min","Comedies, Dramas, International Movies","Quick to throw punches in the name of justice, a young man must find a calmer way to win over the pacifist father of the girl he wishes to marry."
"4241",81213874,"Vodka Diaries","113 min","Dramas, International Movies, Thrillers","While investigating a series of murders and the nightclub that links them, a detective’s case takes an alarming turn when his wife goes missing."
"4243",81213884,"Zed Plus","131 min","Comedies, Dramas, International Movies","A philandering small-town mechanic's political ambitions are sparked when the visiting prime minister mistakenly grants him special security clearance."
"4244",81045989,"Bill Hicks: One Night Stand","28 min","Stand-Up Comedy","Bill Hicks remembers a wild night in 1989 and offers his views on puffing cigarettes, smoking weed, drinking, sex, commercials and music."
"4246",70059483,"Bill Hicks: Relentless","61 min","Stand-Up Comedy","In one of his most iconic performances, late comedian Bill Hicks demonstrates what made him such a singular talent and a force to be reckoned with."
"4247",80108207,"Bill Hicks: Revelations","56 min","Stand-Up Comedy","In his final recorded special, the iconoclastic comedian channels Goat Boy and tackles provocative topics like British porn, pot and the priesthood."
"4248",70043231,"Bill Hicks: Sane Man","81 min","Stand-Up Comedy","Filmed in 1989 at a turning point in comedian Bill Hicks's career, this rare onstage performance captures him spouting off on a variety of topics."
"4255",60004393,"Sam Kinison: Breaking the Rules","50 min","Stand-Up Comedy","The one-time preacher shakes and shudders as he tears into subjects including sex, marriage, religion, drugs and famine in this HBO special."
"4256",70026468,"Sam Kinison: Family Entertainment Hour","49 min","Stand-Up Comedy","Comic Sam Kinison lets it rip with this performance at L.A.'s Wiltern theatre, skewering every segment of modern society from religion to television."
"4262",81031650,"The Bill Murray Stories: Life Lessons Learned From a Mythical Man","72 min","Documentaries","This documentary highlights spontaneous encounters with the elusive, comedic veteran, who touches lives by simply showing up anywhere."
"4263",81006261,"The Seven Deadly Sins the Movie: Prisoners of the Sky","100 min","Action & Adventure, Anime Features, International Movies","The Seven Deadly Sins aid the Sky People against a powerful group of demons hellbent on resurrecting a demonic beast sealed over 3,000 years ago."
"4264",81045509,"Tim Allen: Men Are Pigs","30 min","Stand-Up Comedy","Standup comedian Tim Allen delivers a set dedicated to ""men stuff"" like lawn care, power tools and why he grunts like an animal."
"4266",70298389,"Tim Minchin And The Heritage Orchestra Live","146 min","Music & Musicals, Stand-Up Comedy","Flanked by a full orchestra, Tim Minchin takes the Royal Albert Hall by storm with a wonderfully witty evening of satirical musical comedy."
"4267",81045530,"Tim Minchin: So F**king Rock","127 min","Music & Musicals, Stand-Up Comedy","Comedic pianist Tim Minchin performs a host of his catchy songs that touch on everything from the Middle East to the healing power of canvas bags."
"4268",81045511,"Todd Glass: Stand-Up Special","46 min","Stand-Up Comedy","Standup comedian Todd Glass gets right down to it, with sly observations on accepting directions, denying compliments and being afraid of the dark."
"4269",70266169,"Tom Papa Live in New York City","57 min","Stand-Up Comedy","Comedian Tom Papa riffs on the trials of married life, fatherhood in the 21st century, domestic pets and more in his stand-up show."
"4272",80210716,"Born Strong","86 min","Documentaries, Sports Movies","Four 400-pound giants fight for the crown at the Arnold Strongman Classic and offer a glimpse into their lives leading up to the competition."
"4273",80230402,"Dave Chappelle: Equanimity & The Bird Revelation","1 Season","Stand-Up Comedy & Talk Shows, TV Comedies","Comedy titan Dave Chappelle caps a wild year with two stand-up specials packed with scorching new material, self-reflection and tough love."
"4275",80230465,"Elles étaient en guerre (1914-1918)","93 min","Documentaries, International Movies","Trace the overlapping journeys of exceptional women swept up in World War I and hear their tales of bravery on history's front lines."
"4277",80168234,"Fun Mom Dinner","82 min","Comedies, International Movies","Four preschool moms with little in common need a night out to take a break from their kids. But one thing leads to another, and things get rowdy."
"4278",80221778,"Geronimo Stilton","1 Season","Kids' TV, TV Comedies","With the help of brainy and adventurous sidekicks, New Mouse City's favorite journalist investigates mysteries that take him around the world,"
"4279",80184972,"Ghost House","100 min","Horror Movies","While visiting the site of a supernatural shrine in the Thai countryside, a vacationing couple unwittingly upsets a vengeful demon."
"4285",80208212,"Twice","53 min","Documentaries, International Movies","This documentary reenacts the experiences of late activist Tsutomu Yamaguchi, a survivor of both atomic bombings on Japan in 1945."
"4286",80218432,"You Can Tutu","87 min","Children & Family Movies","A gifted young ballet dancer struggles to find her footing in an uptight ballet school that brings her and her family to a brand-new neighborhood."
"4287",80115134,"Dog Eat Dog","93 min","Dramas, Thrillers","A delusional ex-con rejoins his unhinged former partners for one last job: kidnap the baby of a mobster's enemy for ransom."
"4288",80098284,"Mr. Pig","97 min","Dramas, Independent Movies, International Movies","An aging California pig farmer whose property is on the brink of foreclosure makes a last-ditch trip across the border to sell his prized hog."
"4292",80087891,"Anesthesia","90 min","Dramas, Independent Movies","After a popular professor is attacked on a New York street, the story of how a series of intertwined events led to the life-altering assault unfolds."
"4294",80022613,"The Autopsy of Jane Doe","86 min","Horror Movies, Independent Movies, Thrillers","A father-son team of small-town coroners performs an autopsy on an unidentified woman with mysterious injuries and a terrifying secret."
"4295",80163263,"Goon: Last of the Enforcers","102 min","Comedies, International Movies, Sports Movies","Injury and family push hockey player Doug Glatt into retirement, but his plans change when his beloved former team appoints his nemesis as captain."
"4297",81078397,"The First Temptation of Christ","46 min","Comedies, International Movies","Jesus, who's hitting the big 3-0, brings a surprise guest to meet the family. A Christmas special so wrong, it must be from comedians Porta dos Fundos."
"4298",80221271,"Tiffany Haddish: Black Mitzvah","56 min","Stand-Up Comedy","On her 40th birthday, Tiffany Haddish drops a bombastic special studded with singing, dancing and raunchy reflections on her long road to womanhood."
"4299",80103374,"War on Everyone","98 min","Action & Adventure, Comedies","Terry and Bob excel at blackmailing small-time crooks. But when the two cops target a big score, they learn not all criminals are easily intimidated."
"4300",81167490,"Wish Man","108 min","Children & Family Movies, Dramas","After surviving a life-threatening accident, a troubled cop finds new purpose when he bonds with a terminally ill little boy. Based on a true story."
"4302",81012943,"Silencer","88 min","Action & Adventure, Independent Movies","When a drug lord kidnaps his girlfriend’s daughter, a retired assassin leaves his newly peaceful life to go on a ruthless rampage to rescue the child."
"4303",80044536,"Diary of a Chambermaid","96 min","Dramas, International Movies","An attractive young woman goes to work as a chambermaid for a troublesome couple. The wife is unreasonable, and the husband won't stop hitting on her."
"4304",70301620,"Rezeta","84 min","Dramas, Independent Movies, International Movies","Gorgeous and free-spirited Albanian model Rezeta arrives in Mexico City, and soon uses her charms to take up a carefree new life in the metropolis."
"4305",70213471,"Lawless","116 min","Dramas","This true-to-life action saga profiles Virginia's bootlegging Bondurant brothers, whose exploits during the Prohibition era made them outlaw heroes."
"4308",70132228,"Shelter","112 min","Horror Movies, Thrillers","A forensic psychiatrist has to think outside the box when she takes on a patient whose multiple personalities lead to a trail of murder victims."
