"","show_id","title","duration","listed_in","description"
"1385",70020947,"King's Ransom","98 min","Action & Adventure, Comedies","A wealthy, despicable businessman comes to the realization that he may lose half his fortune to the obnoxious wife he's trying to divorce. So, he decides to arrange his own kidnapping in order to wipe himself out and claim poverty."
"1386",70117305,"Legion","100 min","Action & Adventure, Horror Movies, Sci-Fi & Fantasy","A motley crew of apocalypse survivors living at an abandoned truck stop never suspects that the pregnant woman among them is carrying the Messiah."
"1387",701346,"Like Water for Chocolate","105 min","Classic Movies, Dramas, International Movies","When Pedro marries her sister, Tita throws herself into her cooking – and discovers she can transfer her emotions through the food she prepares."
"1389",709163,"Logan's Run","118 min","Action & Adventure, Classic Movies, Cult Movies","In the 23rd century, inhabitants of a domed city exist in a world filled with life's pleasures – but no one is allowed to live past the age of 30."
"1390",709380,"Lolita","153 min","Classic Movies, Dramas, Romantic Movies","In this black comedy, an English professor marries his landlady to get closer to his forbidden obsession: her teenage daughter."
"1391",1150871,"Love Jones","109 min","Comedies, Dramas, Independent Movies","In this urban romantic comedy set in Chicago, the ups and downs of courtship play out between a young black poet and a pretty shutterbug."
"1392",70082264,"Mad Money","99 min","Comedies","A woman joins the janitorial staff of the Federal Reserve Bank and conspires with two co-workers to pilfer old money that's scheduled to be destroyed."
"1394",1179583,"Money Talks","96 min","Action & Adventure, Comedies","TV news reporter James Russell helps put small-time criminal Franklin Hatchett in jail, but turns to protecting Hatchett when he escapes from prison."
"1395",70044595,"Monster House","91 min","Children & Family Movies, Comedies","Three friends uncover the truth about a scary abandoned house in their neighborhood that has a personality of its own and seems to be eating people."
"1396",60011729,"Mutiny on the Bounty","185 min","Action & Adventure, Classic Movies, Dramas","Marlon Brando gives a nuanced performance as the aristocratic Lt. Fletcher Christian, an officer aboard the HMS Bounty who leads a mutiny against the ship's tyrannical Capt. Bligh."
"1397",70044883,"Nacho Libre","92 min","Comedies, Sports Movies","When Ignacio learns of an orphanage's financial woes, he pitches in to help – by disguising himself and joining the professional wrestling circuit."
"1399",60021590,"Ocean's Eleven","127 min","Action & Adventure, Classic Movies, Comedies","Frank Sinatra leads an all-star cast as Danny Ocean, who decides to knock over a few casinos on the Las Vegas Strip with his buddies."
"1400",60023638,"Paid in Full","98 min","Action & Adventure, Dramas","This fictionalized account of three real-life notorious Harlem drug dealers is told in flashbacks as they plunge into the world of hustling."
"1402",70031792,"Rebel Without a Cause","111 min","Classic Movies, Dramas","When Jim Stark arrives in a new town with his troubled past firmly in tow, he quickly falls for the girl next door and befriends the vulnerable Plato."
"1403",70100383,"Revolutionary Road","120 min","Dramas, Romantic Movies","April and Frank's marriage unravels when a plan to change their ""perfect"" lives becomes their last hope to escape lives engulfed in emptiness."
"1404",60002403,"Rosemary's Baby","137 min","Classic Movies, Horror Movies, Thrillers","A woman is thrilled to find out she's pregnant. But as her belly grows, the more certain she becomes that her unborn child is in serious danger."
"1405",17236920,"Rounders","121 min","Dramas","A law student befriends and ""befoes"" a fellow gambling addict and a club owner, and tensions run high when they must come up with $15k in just 5 days."
"1406",923574,"Rumble in the Bronx","89 min","Action & Adventure, Comedies, International Movies","During a visit to the Bronx to help out at his uncle's store, a cheerful martial arts expert springs into action when a gang terrorizes the shop."
"1407",81152930,"Santa Girl","91 min","Children & Family Movies, Comedies, Romantic Movies","Fleeing the family business and an arranged marriage, Santa’s daughter chooses a magical adventure of her own: College."
"1408",973861,"Sling Blade","135 min","Dramas, Independent Movies","A man returns home after being released from a psychiatric hospital, where he'd been confined since age 12 for murdering his mother and her lover."
"1409",70058796,"Sparkle","98 min","Dramas, Music & Musicals","In 1950s Harlem, three singing sisters hit the big time and end up losing one another in this musical melodrama inspired by the Supremes."
"1410",70047101,"Spider-Man 3","139 min","Action & Adventure, Sci-Fi & Fantasy","The seemingly invincible Spider-Man goes up against an all-new crop of villains in the third installment of the blockbuster adventure series."
"1411",81189396,"Spitfire: The Plane that Saved the World","95 min","Documentaries","In this epic documentary, last-surviving veterans trace the history of a legendary fighter aircraft that dominated the air during the Battle of Britain."
"1412",70093991,"Step Brothers","98 min","Comedies","Brennan and Dale might be grown men, but that doesn't stop a childish sibling rivalry from erupting after Brennan's mom marries Dale's dad."
"1413",60033247,"Superfly","91 min","Action & Adventure, Classic Movies, Dramas","To get away from the thug life, cocaine dealer Youngblood Priest puts together one last deal that will net him enough money to start over."
"1414",70060000,"The Brave One","122 min","Dramas, Thrillers","New York City radio host Erica Bain decides to take the law into her own hands after losing her fiancé in a brutal Central Park attack."
"1415",70295067,"The Christmas Candle","100 min","Dramas, Faith & Spirituality","A progressive new minister's arrival in a small village threatens to end an age-old tradition that brings a yuletide miracle to one of the residents."
"1416",70031779,"The Cincinnati Kid","103 min","Classic Movies, Dramas","In Depression-era New Orleans, cocksure stud poker player Eric Stoner – the titular Cincinnati Kid – challenges longtime champ Lancey ""The Man"" Howard to a showdown at the table, where a war of wills – and nerve – ensues."
"1417",1178866,"The Game","129 min","Thrillers","Nicholas receives an unusual birthday present from his brother, Conrad – a gift certificate to play a unique kind of game formulated by ""CRS."""
"1418",60033312,"The Great Raid","133 min","Action & Adventure, Dramas","In World War II, a battalion goes on a daring rescue mission to liberate the Americans and Filipinos who've been captured by the Japanese."
"1421",684847,"The Last Boy Scout","105 min","Action & Adventure, Comedies","Private eye Joe Hallenbeck is forced to team up with a disgraced quarterback to uncover a conspiracy by a politician and a football team owner."
"1422",81150305,"The Man Without Gravity","107 min","Dramas, International Movies","A gravity-defying boy raised in seclusion matures into an extraordinary man – and an international celebrity – who longs for human connection."
"1423",20557937,"The Matrix","136 min","Action & Adventure, Sci-Fi & Fantasy","A computer hacker learns that what most people perceive as reality is actually a simulation created by machines, and joins a rebellion to break free."
"1424",60027695,"The Matrix Reloaded","138 min","Action & Adventure, Sci-Fi & Fantasy","The crew must protect Zion, the last outpost still under human control, after it is pinpointed by the machines responsible for the Matrix."
"1425",60031303,"The Matrix Revolutions","129 min","Action & Adventure, Sci-Fi & Fantasy","The final installment in the Matrix trilogy finds an unconscious Neo trapped in a subway station in a zone between the Matrix and the machine world."
"1427",848915,"The Pelican Brief","141 min","Dramas, Thrillers","When law student Darby Shaw theorizes about the assassinations of two Supreme Court justices, she is put in danger and turns to a reporter for help."
"1428",60022980,"The Tuxedo","99 min","Action & Adventure, Comedies","After a government spy is hospitalized, New York City cab driver Jimmy unwillingly takes over the spy's role – with the aid of a computerized tuxedo."
"1429",60003961,"Thelonious Monk: Straight, No Chaser","89 min","Documentaries, Music & Musicals","The spotlight shines on iconic jazz pianist and composer Thelonious Monk in this 1988 documentary featuring vintage performance clips and interviews."
"1431",70060005,"Vantage Point","90 min","Action & Adventure","Moments after he arrives in Spain for an antiterrorism summit, U.S. President Ashton is shot."
"1434",70084791,"Wild Child","98 min","Comedies, Romantic Movies","When a spoiled girl pushes her father too far with her spending and outlandish behavior, he ships the Malibu princess off to a strict boarding school."
"1436",70123542,"Zombieland","88 min","Comedies, Horror Movies","Looking to survive in a world taken over by zombies, a dorky college student teams with an urban roughneck and a pair of grifter sisters."
"1437",70107499,"A Wednesday","103 min","Action & Adventure, Dramas, International Movies","After receiving an anonymous tip about a bomb, a police commissioner must negotiate with the terrorist, who demands the release of four militants."
"1438",70123117,"Aagey Se Right","117 min","Comedies, International Movies, Music & Musicals","A cop full of self-doubt loses his gun five days before he's due to leave the force, and becomes an unexpected hero as he tries to retrieve it."
"1439",70100644,"Aamir","95 min","International Movies, Thrillers","In this high-tension thriller, an anonymous caller on a cell phone threatens to harm a man's family if he doesn't carry out every order."
"1440",80057750,"ABCD 2","146 min","Dramas, International Movies, Music & Musicals","After being accused of cheating on a reality TV show, a dance troupe seeks to redeem itself by winning the World Hip-Hop Dance Championship."
"1441",70229045,"ABCD: Any Body Can Dance","136 min","Dramas, International Movies","Thrown out of the elite dance studio he founded, Vishnu's spirits rebound when he sees young street dancers prepping for an annual contest."
"1442",70139073,"Arjun: The Warrior Prince","91 min","Action & Adventure, Dramas, International Movies","This animated retelling of the classic Indian tale of Prince Arjun – part of the Sanskrit epic Mahabharata – begins during the prince's youth."
"1443",81024731,"Asees","123 min","Dramas, International Movies, Music & Musicals","When a dispute breaks out between five siblings over their mother’s property, one devoted son will go to any lengths to protect her land."
"1444",70219525,"Barfi!","144 min","Comedies, Dramas, International Movies","Years after rejecting Barfii, a hearing and speech impaired young man, for a more ""appropriate"" suitor, Shruti finds herself falling for him."
"1445",16914787,"BASEketball","103 min","Comedies, Sports Movies","When two slackers' made-up sport, BASEketball, becomes a national craze, they hope to cash in on the basketball/baseball hybrid's popularity."
"1449",80039595,"Chaar Sahibzaade","126 min","Dramas, Faith & Spirituality, International Movies","With a horde of enemy invaders bearing down, four sons of an illustrious Sikh guru lead a tiny but valiant army into a desperate fight for freedom."
"1450",70123120,"Chance Pe Dance","121 min","Comedies, Dramas, International Movies","Having risen from humble beginnings, an ambitious young man sets his sights on winning a major dance competition that could catapult him to fame."
"1451",80224055,"Christmas With A View","91 min","International Movies, Romantic Movies","Still reeling from a business failure, the restaurant manager of a ski resort finds her world jolted by a new chef, who has his own hidden past."
"1452",70052249,"Chup Chup Ke","158 min","Comedies, Dramas, International Movies","Mistaking a broke, small-time hustler for a millionaire, two bumbling fishermen hatch a scheme to use him to help pay off their debts."
"1453",70084775,"Dhan Dhana Dhan Goal","157 min","Dramas, Music & Musicals, Sports Movies","In a last-ditch effort, the jaded coach of the Southall United Football Club assembles a ragtag team and helps lead the team to a comeback season."
"1454",70114588,"Dhoondte Reh Jaoge","124 min","Comedies, International Movies, Music & Musicals","An accountant and a producer hatch a scheme to finance a movie, while making every effort to ensure that it flops so they may pocket the difference."
"1455",70185139,"Do Dooni Chaar","106 min","Comedies, International Movies","A struggling math teacher holds down a second job to keep his family afloat. But when he receives a wedding invitation, he's determined to attend."
"1456",80232501,"Edge of Fear","92 min","Independent Movies, Thrillers","During a wilderness getaway, a gang of sociopathic criminals kidnap a woman and assault her husband, who must summon all his strength to save her."
"1457",80210147,"Edmilson Filho: Notas, Comedy about Relationships","80 min","Stand-Up Comedy","Brazilian comedian Edmilson Filho walks his audience through the stages of a modern relationship, playing up the differences between men and women."
"1458",80224606,"Filmworker","94 min","Documentaries","Leon Vitali had a thriving acting career most others would envy. Then he gave it all up to devote himself completely to the vision of Stanley Kubrick."
"1459",80058851,"Gaddar: the Traitor","126 min","Dramas, International Movies, Thrillers","An Indian man who has become a major business mogul in Canada must return to his homeland where he's reviled due to being wrongly branded a traitor."
"1461",70219528,"Ghanchakkar","129 min","Comedies, International Movies, Thrillers","Former con artist Sanju surrounds himself with the finer things, a blissful life troubled by only one thing: his wife, who wants even more."
"1463",70241088,"Grandmaster","133 min","International Movies, Thrillers","Anticipating the next move in a serial killer's grisly game, a police chief realizes that his daughter and estranged wife are the next likely victims."
"1464",70068799,"Hattrick","109 min","Comedies, Dramas, International Movies","Stories of personal victories coincide with Team India's battle for the Cricket World Cup in this engaging ensemble drama."
"1465",70229044,"Heroine","143 min","Dramas, International Movies","One woman experiences the dramatic highs and lows of fame in this voyeuristic glimpse past the glitz and glamour of a Bollywood superstar's life."
"1466",70254349,"Himmatwala","140 min","Action & Adventure, Comedies, International Movies","A young man returns to his native village on a mission of vengeance after his father commits suicide in the wake of false accusations."
"1467",70254342,"Husbands in Goa","150 min","Comedies, International Movies, Music & Musicals","Three professional friends, all husbands living with domineering wives, take a well-deserved vacation in the resort city of Goa."
"1468",80084838,"Jatts in Golmaal","128 min","Comedies, International Movies, Music & Musicals","Without fully realizing the consequences, a boy who wants to relocate from India to Canada sells his heart to a gangster in need of a transplant."
"1469",70254346,"Kai Po Che!","120 min","Dramas, International Movies, Sports Movies","This Bollywood drama tells the story of three best friends who dream of starting a cricket training academy in Ahmedabad for very different reasons."
"1470",70229040,"Kalakalappu","154 min","Comedies, International Movies, Music & Musicals","Cheenu dreams of resurrecting the restaurant he has inherited to its former glory, but his brother, a compulsive gambler, loses the place to a cop."
"1471",70056663,"Katt Williams: The Pimp Chronicles: Pt. 1","45 min","Stand-Up Comedy","In this 2006 show, comic Katt Williams uses his edgy style and personal experiences to paint a sassy, hilarious portrait of life in black America."
"1472",80067906,"Katti Batti","132 min","Comedies, Dramas, International Movies","After falling in love during college, architect Maddy and free spirit Payal have five wonderful years together, until a mystery suddenly divides them."
"1473",70071832,"Life in a ... Metro","126 min","Dramas, International Movies, Music & Musicals","A group of Mumbai up-and-comers search for love and struggle for success in this ensemble drama that centers on an eager young call-center executive."
"1474",70273401,"Marc Maron: Thinky Pain","95 min","Stand-Up Comedy","Alternative comic Marc Maron is back on stage in New York to talk Chinese food, drug abuse, sex in hotel rooms and life with his girlfriend."
"1475",80097390,"Morris from America","91 min","Dramas, Independent Movies, International Movies","When his father moves from the U.S. to Heidelberg, Germany, an African American teenager struggles to find his place and pursue his hip-hop dreams."
"1476",70106268,"Mumbai Meri Jaan","135 min","Dramas, International Movies","A moving portrayal of the 2006 train bombings in Mumbai, this Indian drama follows the interconnected stories of several strangers."
"1477",80039594,"Mundeyan Ton Bachke Rahin","139 min","Comedies, International Movies, Music & Musicals","When they both fall for the same girl, best pals and shameless womanizers Prince and Jassi go head-to-head to compete for her love."
"1478",70139076,"No One Killed Jessica","131 min","Dramas, International Movies","This thriller tells the true story of model Jessica Lall – who was shot dead in a restaurant – and the campaign to bring her killer to justice."
"1479",70109758,"Oye Lucky! Lucky Oye!","118 min","Comedies, Dramas, International Movies","Starting as a petty thief, a man rises to become one of the city's biggest operators and carves out the kind of lifestyle he'd once only dreamed of."
"1480",70123126,"Paan Singh Tomar","129 min","Action & Adventure, Dramas, International Movies","Paan Singh Tomar goes from celebrated runner to star brigand and rebel when life after sports fails to unfold as planned."
"1481",70303431,"Raja Natwarlal","131 min","Dramas, International Movies, Thrillers","A small-time con man assembles a team to help him avenge the death of his partner-in-crime at the hands of a powerful gangster."
"1482",70254351,"Satyagraha","146 min","Dramas, International Movies, Music & Musicals","In this Bollywood drama, a corporate go-getter sees his priorities shift when personal tragedy brings him face-to-face with political corruption."
"1483",70275076,"Settai","123 min","Comedies, International Movies, Music & Musicals","Asked to deliver a package for a friend, Madhu gets her fiancé, Jayaganthan, to take care of it, and he then passes the task to one of his roommates."
"1484",80189997,"Sigaram Thodu","141 min","Dramas, International Movies, Thrillers","A policeman's son overcomes his reluctance to join the force following a brutal attack on his father and ends up in the middle of a robbery case."
"1485",81015100,"Sommore: The Reign Continues","93 min","Stand-Up Comedy","Self-proclaimed ""Queen of Comedy"" Sommore storms the stage to deliver a riotous stand-up performance in Charlotte, North Carolina."
"1486",80076581,"Stink!","91 min","Documentaries","After noting a strange odor in his child’s pajamas, a single dad’s search for the source uncovers potentially toxic secrets of the chemical industry."
"1488",81025404,"The Tigers of Scotland","58 min","Documentaries","This documentary highlights the endangered existence of the Scottish wildcats, and the conservation efforts required to prevent their extinction."
"1489",80182949,"The Untold Tales of Armistead Maupin","91 min","Documentaries, LGBTQ Movies","This documentary traces the life of ""Tales of the City"" author Armistead Maupin, from his conservative roots to his rise as an LGBTQ champion."
"1490",70060017,"The Water Horse: Legend of the Deep","112 min","Children & Family Movies","A boy watches an egg he found hatch into something incredible. But how long can he keep such a big secret from his mom – and the Scottish government?"
"1491",70266675,"Transcendence","119 min","Sci-Fi & Fantasy, Thrillers","Two computer scientists work to achieve technological singularity to create a world where computers can transcend the abilities of the human brain."
"1492",80155792,"Vaya","106 min","Dramas, Independent Movies, International Movies","Three youths from rural South Africa set out for Johannesburg, where they're thrust into the seedy underbelly of the city and must fight to survive."
"1493",70108590,"Welcome to Sajjanpur","131 min","Comedies, Dramas, International Movies","An educated man assists the illiterate residents of his village with written correspondence, sometimes manipulating the letters to suit his interests."
"1495",70185141,"Zokkomon","104 min","Children & Family Movies, Dramas","When his cruel uncle abandons him, a young orphan learns to access the untapped superpowers that have been waiting within him all along."
"1496",80201826,"6-5=2","103 min","Horror Movies, International Movies, Thrillers","Six friends decide to undertake a grueling mountain trek, only to find that the difficulties in store for them are not merely physical."
"1497",80158388,"Bandie","141 min","Action & Adventure, Dramas, International Movies","Heirless Maharaj Brajbhan leaves his throne to his cousin Vikram, but when Brajbhan's wife, Badi Rani, finally conceives, Vikram plots to destroy her."
"1498",80203778,"Beiimaan Love","115 min","Dramas, International Movies, Romantic Movies","After having her heart broken by a man who seduced her at a party, a young, ambitious woman concocts a scheme to get revenge."
"1499",80201820,"Coffee with D","120 min","Comedies, Independent Movies, International Movies","Low TV ratings drive a well-known journalist to concoct a plan to interview a notorious underworld figure who is also a suspected terrorist."
"1500",80103312,"Getaway Plan","104 min","International Movies, Thrillers","Professional burglar and blowtorch expert Víctor is recruited by the Russian mafia to break into a vault as part of an elaborate bank heist."
"1502",80202605,"Hajwala: The Missing Engine","97 min","Action & Adventure, Dramas, International Movies","A competitive streetcar racer's obsession with winning drive him to develop a vehicle with an innovative engine that's never been used before."
"1504",80203791,"Kacche Dhaagey","120 min","Dramas, International Movies, Romantic Movies","While visiting India for her cousin's wedding, a Canadian girl develops strong feelings for a boy from a lower caste."
"1505",80079229,"Kis Kisko Pyaar Karoon","132 min","Comedies, International Movies","A man's decision to marry three women, to keep them from committing suicide, complicates his relationship with his girlfriend."
"1506",80080145,"Moor","135 min","Dramas, Independent Movies, International Movies","A railway stationmaster tries to cope with his wife's death, his estrangement from his son and the corrupt world in which he lives."
"1509",80157797,"Pettersson and Findus 2","82 min","Children & Family Movies, Comedies","Christmas is just around the corner, but Pettersson and Findus are worried the snowy weather (and lack of a tree) may keep them from celebrating."
"1510",80032364,"Punjab 1984","158 min","Dramas, International Movies","During a time of political turmoil, a mother goes on a journey in search of her missing son, who has been misjudged and labeled a terrorist."
"1511",80203786,"Rivaaz","107 min","Dramas, Independent Movies, International Movies","In a village where girls are auctioned off rather than married, a man falls in love with a girl who is about to face the bidders."
"1512",80032097,"Romeo Ranjha","122 min","Action & Adventure, Comedies, Music & Musicals","Two common boys travel from India to Thailand to find success and money, enjoying their friendship and finding ways to cheat the cheats."
"1514",80156684,"Savage Dog","95 min","Action & Adventure, Independent Movies","A former professional boxer serving time in a brutal labor camp must fight incredible odds to gain his freedom and avenge an act of violence."
"1516",80174727,"The Bittersweet","98 min","Action & Adventure, Dramas, International Movies","As a killer stalks the streets, a troubled young courier suspects that a doctor may be the long-lost sister he hasn't seen since childhood."
"1522",80201827,"Trip to Bhangarh: Asia's Most Haunted Place","113 min","International Movies, Thrillers","To amuse themselves, six college friends decide to pay a visit to a fortress believed by some to be the most haunted place in Asia."
"1523",80179288,"Undercover Grandpa","94 min","Action & Adventure, Children & Family Movies, Comedies","Jake's date with his dream girl takes a turn when she disappears, and Jake's grandpa – a former intelligence officer – sets out to find her."
"1524",80203780,"Waarrior Savitri","120 min","Action & Adventure, International Movies, Sci-Fi & Fantasy","In a modern adaptation of a mythological tale, a devoted wife is willing to do whatever it takes to rescue her husband from the clutches of death."
"1525",80216215,"Warehoused","92 min","Comedies, Dramas, International Movies","A soon-to-be-retiring Mr. Lino teaches 20-something Nin the strict rules of his new warehouse job in this dramedy about the absurdities of work life."
"1526",80211371,"Yaara O Dildaara","132 min","Dramas, International Movies, Music & Musicals","The patriarch of a wealthy family with one industrious son and one who's a playboy arranges for the marriage of one to the woman the other loves."
