"","show_id","title","duration","listed_in","description"
"2687",80132601,"Havenhurst","85 min","Horror Movies, Thrillers","An alcoholic with a tragic past rents an apartment in a building for those in recovery, but soon learns the truth about residents who get ""evicted."""
"2689",80176866,"Man to Man","1 Season","Crime TV Shows, International TV Shows, Korean TV Shows","Disguised as a bodyguard, a special agent must complete his national secret tasks while pandering to the whims of his ill-tempered world star."
"2692",80114989,"Sword Master","108 min","Action & Adventure, Dramas, International Movies","Haunted by the past, a master swordsman masks his identity to work anonymously as a janitor in a brothel, setting in motion a violent chain of events."
"2694",81092768,"#Selfie","125 min","Comedies, Dramas, International Movies","Two days before their final exams, three teen girls make a seaside getaway to end their adolescence with a bang."
"2695",81092766,"#Selfie 69","119 min","Comedies, Dramas, International Movies","After a painful breakup, a trio of party-loving friends makes a bet: who can get married in three days."
"2696",70060018,"10,000 B.C.","109 min","Action & Adventure","Fierce mammoth hunter D'Leh sets out on an impossible journey to rescue the woman he loves from a vicious warlord and save the people of his village."
"2697",70202141,"50/50","100 min","Comedies, Dramas, Independent Movies","An otherwise healthy twentysomething has a comically early midlife crisis when he gets slapped with a cancer diagnosis and a 50-50 chance of survival."
"2699",81032375,"Bullitt County","98 min","Independent Movies, Thrillers","When four college friends reunite for a bachelor party, their hunt for cash said to be hidden in Kentucky's backwoods leads to bloodshed and betrayal."
"2700",352989,"Carrie","98 min","Classic Movies, Cult Movies, Horror Movies","An outcast teen with telekinetic ability lashes out with her deadly power when the high school ""in crowd"" torments her with a sick joke at the prom."
"2702",81062606,"III Smoking Barrels","128 min","Dramas, Independent Movies, International Movies","In three stories set in Northeast India, a child goes on the run, a young adult falls in with the wrong crowd and a desperate man turns to crime."
"2704",81092767,"Love Is a Story","105 min","International Movies, Romantic Movies","Two young artists, a violin player and an actress, fight to achieve their dreams and keep their relationship together during Christmastime."
"2705",81092909,"Oh, Ramona!","109 min","Comedies, International Movies","Awkward 16-year-old Andrei is infatuated with his alluring but aloof schoolmate Ramona – until he meets stunning hotel clerk Anemona while on vacation."
"2706",81070008,"Prosecuting Evil: The Extraordinary World of Ben Ferencz","83 min","Documentaries","A gripping profile of Ben Ferencz, the last surviving lead prosecutor at the Nuremberg trials whose lifelong desire for justice altered the rule of law."
"2707",70098605,"Righteous Kill","101 min","Dramas, Thrillers","Two detectives investigate a rash of vigilante killings linked to an old case, suggesting they might have put an innocent man behind bars."
"2708",81077539,"Satan & Adam","78 min","Documentaries, Music & Musicals","An aging blues guitarist and a grad student form an unlikely duo while busking on the street corners of 1980s Harlem."
"2709",20129240,"Small Soldiers","110 min","Action & Adventure, Comedies, Sci-Fi & Fantasy","When the Commando Elite, a group of toy action figures, are released before they've been tested, they attack the children playing with them."
"2710",70108017,"The Box","116 min","Sci-Fi & Fantasy, Thrillers","A couple must decide whether to push a button that will net them a million dollars but that will also cause the death of a complete stranger."
"2711",70011219,"The Phantom of the Opera","141 min","Dramas, Music & Musicals, Romantic Movies","In 1870, a disfigured recluse roams beneath a Parisian opera house and takes under his wing a young soprano, with whom a love triangle develops."
"2712",80097424,"The Space Between Us","120 min","Action & Adventure, Romantic Movies, Sci-Fi & Fantasy","After years of limited contact with Earth, an inquisitive teen who lives on Mars makes an interplanetary trek to discover his own origins."
"2713",80203143,"Then Came You","97 min","Comedies, Dramas, Independent Movies","A hypochondriac confronts his fear of death when a terminally ill teen girl enlists him to help her complete her bucket list."
"2714",81068732,"We Are Legends","109 min","Action & Adventure, International Movies, Sports Movies","Raised in a boxing gym, two orphaned brothers become highly skilled martial artists and must combat threats in the streets and the ring."
"2715",60026155,"What a Girl Wants","105 min","Children & Family Movies, Comedies","In search of the father she's never met, the daughter of a bohemian American woman heads to Europe and finds that her dad is an uptight politician."
"2716",80994443,"B.A. Pass 2","126 min","Dramas, International Movies","A young woman eager to avoid an arranged marriage moves to Mumbai, where she learns hard truths about show business, life and love."
"2717",80245442,"Bad Genius","130 min","International Movies, Thrillers","A top student gets pulled into a cheating racket with increasingly higher risks and even higher rewards. But she may lose much more than she gains."
"2718",80190515,"Bobbi Jene","99 min","Documentaries","This candid profile follows dancer Bobbi Jene Smith as she leaves the company of Israeli choreographer Ohad Naharin to forge her own artistic path."
"2720",80048218,"He Named Me Malala","89 min","Documentaries","This documentary tells the story of a teenage Pakistani girl shot for her advocacy of women's education, her survival, and her continued efforts."
"2721",60033300,"Miracle","136 min","Children & Family Movies, Dramas, Sports Movies","U.S. hockey coach Herb Brooks unites a motley crew of college athletes and turns them into a force to be reckoned with at the 1980 Winter Olympics."
"2722",70011206,"National Treasure","131 min","Action & Adventure, Children & Family Movies","Modern treasure hunters search for a chest of riches rumored to have been stashed away by George Washington, Thomas Jefferson and Benjamin Franklin."
"2723",80998558,"Natsamrat - Asa Nat Hone Nahi","165 min","Dramas, International Movies","A veteran Shakespearean actor steps off the stage and into the painful tragedy of old age, facing ungrateful family and his fleeting legacy."
"2725",80168167,"Outside In","110 min","Dramas, Independent Movies","After serving time for a crime he didn’t commit, a 38-year-old man forms a complicated, life-altering bond with the woman who advocated for his early release."
"2726",80245626,"Pedal the World","85 min","Documentaries, International Movies, Sports Movies","Over the course of one memorable and adventure-filled year, Felix Starck documents his 18,000-kilometer bicycle journey across 22 countries."
"2727",80196584,"Singularity","92 min","Action & Adventure, Dramas, Sci-Fi & Fantasy","Nearly a century after artificial intelligence tried to eradicate people from Earth, two survivors search for a human enclave rumored to still exist."
"2728",80157084,"Aashik Awara","154 min","Dramas, International Movies, Music & Musicals","Raised by a kindly thief, orphaned Jimmy goes on the run from goons and falls in love with Jyoti, whose father indirectly caused his parents' deaths."
"2729",80158580,"Amelia: A Tale of Two Sisters","44 min","Documentaries","Eight decades after her disappearance, Amelia Earhart's incredible accomplishments are still celebrated, thanks in large part to her sister Muriel."
"2730",80108609,"Betting on Zero","104 min","Documentaries","This documentary dives into the complex world of Herbalife, the international nutritional products company accused of being a pyramid scheme."
"2732",80144804,"Catfight","96 min","Comedies, Independent Movies","Two college frenemies whose lives aren't what they hoped meet up decades later and escalate their resentments from verbal jabs to bloody brawls."
"2734",80106038,"Devil's Bride","108 min","Dramas, International Movies","On a small Finnish island in 1666, a teenage girl in love with a married fisherman becomes the center of a tragic witch hunt and power struggle."
"2736",60000901,"How the Grinch Stole Christmas","105 min","Children & Family Movies, Comedies","The Grinch decides to rob Whoville of Christmas – but a dash of kindness from little Cindy Lou Who and her family may be enough to melt his heart."
"2737",80158769,"How to Stage a Coup","47 min","Documentaries","Explore how Caesar, Napoleon, Mussolini, Hitler and modern-day dictators consolidated their considerable power through bold and brazen coups."
"2738",80158579,"Jackie: A Tale of Two Sisters","44 min","Documentaries","Rachael Stirling narrates this multifaceted portrait of former First Lady Jacqueline Kennedy Onassis and her younger sister, Lee Radziwill."
"2740",80158920,"Lens","109 min","Dramas, Independent Movies, International Movies","Addicted to webcams and voyeurism, a married man gets more than he bargained for when an online stranger tries to force him to watch a suicide."
"2741",80107736,"Little Boxes","89 min","Comedies, Dramas, Independent Movies","After moving from New York City to a small town in Washington state, an interracial couple and their preteen son struggle to adjust to their new life."
"2742",80148967,"Love.com","92 min","Comedies, International Movies, Romantic Movies","When a fashion blogger falls for a video game vlogger, their romance goes viral. But separating their virtual life from reality gets complicated."
"2743",70057994,"Maya Memsaab","122 min","Dramas, International Movies, Music & Musicals","A beautiful, wealthy woman’s insatiable appetite for romance leads to tragedy and a police investigation."
"2747",80156937,"Oh Darling Yeh Hai India","154 min","Action & Adventure, Comedies, International Movies","A penniless actor new to Mumbai and a beautiful woman he meets one fateful night try to stop a gangster from replacing India's president with a twin."
"2750",80158546,"Prince","152 min","Dramas, International Movies, Romantic Movies","To better himself, a spoiled prince temporarily assumes a commoner’s identity. But he soon learns his palace has been gifted to his father’s new wife."
"2751",80156936,"Qila","161 min","Dramas, International Movies","When an abusive landowner is murdered, his twin brother sets out to find the killer but quickly discovers that everyone, it seems, wanted him dead."
"2753",80121843,"Smoke & Mirrors","123 min","Dramas, International Movies, Thrillers","Betrayed by the Spanish government he once served, a former secret agent plots to steal millions of dollars embezzled by a corrupt public official."
"2757",80158581,"The Mitfords: A Tale of Two Sisters","44 min","Documentaries","Jessica and Diana were sisters who were separated by just a few years in age. But their political ideologies couldn't have been any farther apart."
"2758",60023237,"Y Tu Mamá También","106 min","Dramas, Independent Movies, International Movies","When rich teens Tenoch and Julio meet the alluring, older Luisa, they try to impress her with stories of a road trip, then convince her to join them."
"2764",80093213,"Spy Time","93 min","Action & Adventure, Comedies, International Movies","When his girlfriend dumps him for being a bore, a working stiff discovers that his father is a secret agent and a dangerous thug is targeting them."
"2766",80103623,"The Heroes of Evil","99 min","Dramas, International Movies","Three teenage misfits find camaraderie in sex, violence and petty crime. But what starts as a lark soon threatens to damage them beyond repair."
"2767",80032640,"The Perfect Dictatorship","143 min","Comedies, Dramas, International Movies","After accepting a colossal bribe, a powerful TV conglomerate gins up fake news stories to enhance the image of a notoriously corrupt politician."
"2768",81098589,"Aziz Ansari: RIGHT NOW","65 min","Stand-Up Comedy","In a comedy special directed by Spike Jonze, Aziz Ansari shares deep personal insights and hilarious takes on wokeness, family and the social climate."
"2769",80221446,"Mary Poppins Returns","131 min","Children & Family Movies, Music & Musicals","In 1930s London, Michael Banks and his three children get some help turning their topsy-turvy world around when his magical childhood nanny reappears."
"2771",80991107,"Mr. Sunshine","1 Season","International TV Shows, Korean TV Shows, Romantic TV Shows","A young boy who ends up in the U.S. after the 1871 Shinmiyangyo incident returns to Korea at a historical turning point and falls for a noblewoman."
"2772",80048977,"The Invitation","100 min","Horror Movies, Independent Movies, Thrillers","A man accepts an invitation to a dinner party hosted by his ex-wife, an unsettling affair that reopens old wounds and creates new tensions."
"2773",70189282,"The Iron Lady","105 min","Dramas, International Movies","Margaret Thatcher, the first female prime minister of Britain, navigates a career destined to change the rules of leadership and politics."
"2774",80119249,"1 Mile to You","105 min","Dramas, Romantic Movies, Sports Movies","After escaping the bus accident that killed his girlfriend, a high school student channels his grief into running, with the help of a new coach."
"2778",80117747,"Take Me","84 min","Comedies, Independent Movies","With his simulated kidnapping business flagging, an entrepreneur jumps at a weekend abduction opportunity – only to find the job isn't what it seems."
"2781",80004286,"Monster High: Scaris, City of Frights","60 min","Children & Family Movies","When Clawdeen gets a chance to study with a top fashion designer, she and her pals hop on a plane to Scaris, France, the city where screams come true."
"2782",81039323,"Sicilian Ghost Story","119 min","Dramas, International Movies, Thrillers","When officials are slow to investigate a mysterious disappearance, a teen girl searches the dark woods on the outskirts of town for the boy she loves."
"2784",80192064,"Luciano Mellera: Infantiloide","66 min","Stand-Up Comedy","Argentina's Luciano Mellera emphasizes the humorous and fantastical aspects of childhood through comedic impersonations and insights on daily life."
"2785",80176715,"The Legacy of a Whitetail Deer Hunter","83 min","Action & Adventure, Comedies, Dramas","A star of hunting videos strives to bond with his 12-year-old son on a wilderness trip but learns familial connections can't be forced."
"2786",80168029,"The Skin of the Wolf","110 min","Dramas, Independent Movies, International Movies","An animal trapper living in an abandoned mountain town in northern Spain seeks to resolve his loneliness by securing a wife."
"2787",80245121,"White Fang","88 min","Children & Family Movies, Dramas","A loyal wolfdog's curiosity leads him on the adventure of a lifetime while serving a series of three distinctly different masters."
"2788",80177339,"Motu Patlu: King of Kings","109 min","Children & Family Movies, Comedies","Motu and Patlu want to help a circus lion get back to the jungle. On the way, the three become caught up in an exciting adventure in the forest."
"2789",80170277,"Speech & Debate","96 min","Comedies, Dramas, Independent Movies","Fed up with the hypocrisy of the adults around them, three creative high school misfits revive an old debate club as a way to fight back."
"2790",80097355,"Brahman Naman","96 min","Comedies, Independent Movies, International Movies","This homage to 1980s teen sex comedies follows a college quiz bowl champion who knows almost everything – except how to talk to women."
"2794",70122316,"Blue Valentine","112 min","Dramas, Independent Movies, Romantic Movies","As Cindy and Dean muddle through their languishing marriage, they hearken back to the golden days when life was filled with possibility and romance."
"2799",80099089,"Skiptrace","107 min","Action & Adventure, Comedies","To capture a crime lord who killed his partner and kidnapped his partner's daughter, a Hong Kong detective teams with a smart aleck American gambler."
"2800",70303706,"Sommore: Chandelier Status","77 min","Stand-Up Comedy","Luminous funnywoman Sommore wows Miami with her unique take on body modification, Internet sex, the world of celebrities and more."
"2803",81039161,"Ramen Shop","90 min","Dramas, International Movies","Ramen chef Masato travels to Singapore to retrace his mother's life and finds a deeper understanding of his family history and culture."
"2804",80240537,"The Red Sea Diving Resort","130 min","Dramas, Thrillers","Undercover agents open up a fake hotel to real tourists as a cover to help smuggle thousands of Ethiopian refugees to safety. Inspired by true events."
"2805",80997870,"Flying Guillotine 2","88 min","Action & Adventure, International Movies","The emperor's reign of terror expands. Heroic outlaw Ma Teng joins a squad of female rebels, whose leader is torn between family loyalties."
"2807",60001377,"The Five Venoms","97 min","Action & Adventure, Cult Movies, International Movies","A dying kung fu master sends his last student to track down five former pupils in order to learn which one of them has become evil."
"2809",81151899,"7 (Seven)","1 Season","TV Shows","Multiple women report their husbands as missing but when it appears they are looking for the same man, a police officer traces their cryptic connection."
"2811",81017011,"American Hangman","99 min","Thrillers","A judge’s kidnapping is streamed live on social media, as a vengeful loner puts him on trial for supposedly sending an innocent man to his death."
"2813",80999990,"Holy Man 2","92 min","Comedies, Faith & Spirituality, International Movies","Former rap musician Joey Boy is now a monk who takes Father Teng's place at his rural temple, where a crisis develops involving a nearby stone quarry."
"2814",80999991,"Holy Man 3","102 min","Comedies, Faith & Spirituality, International Movies","Two new monks, one of them a former rock music star seeking inner peace, join a temple plagued by thieves who are stealing its valuable holy relics."
"2815",81000000,"The Unborn Child","93 min","Horror Movies, International Movies","A couple and their young daughter are haunted by a paranormal, malicious presence – which is soon linked to a temple and a series of abortions."
"2816",80162192,"Loco Love","103 min","Dramas, Independent Movies, International Movies","A young man and woman fall in love but are threatened to be torn apart by the tensions between their Latino and Caucasian communities in Arizona."
"2818",70074100,"All the Boys Love Mandy Lane","91 min","Horror Movies","During a weekend excursion to a secluded ranch, an unwelcome visitor begins picking off the randy admirers of teenage temptress Mandy Lane."
"2819",70224969,"Felipe Esparza: They're Not Going to Laugh at You","58 min","Stand-Up Comedy","""Last Comic Standing"" winner Felipe Esparza runs riot in his first comedy special with his wry comments on life as a wild man from East Los Angeles."
"2820",70261273,"Joan Rivers: Don't Start with Me","69 min","Stand-Up Comedy","At 78, Joan Rivers has no interest in slowing down, and no one's immune from her caustic barbs in this stand-up special."
"2821",70250364,"Katt Williams: Kattpacalypse","61 min","Stand-Up Comedy","Urban comic Katt Williams ushers in Kattpacalypse, exploding with more energy than an atomic bomb and riffing on everything from Doomsday to Obama."
"2822",80198632,"Mission of Honor","107 min","Action & Adventure, Dramas","As Hitler's Nazis threaten to take command of Britain's skies, a squadron of Polish pilots arrives to aid the Royal Air Force against a mutual enemy."
"2825",70278933,"Her","126 min","Dramas, Romantic Movies, Sci-Fi & Fantasy","Love comes to a lonely writer in the sleekest of packages when he finds himself falling for the advanced operating system he bought to run his life."
"2826",80093198,"Tallulah","112 min","Dramas, Independent Movies","While searching for her ex-boyfriend, a young drifter impulsively kidnaps a baby from a neglectful mother and pretends the child is her own."
"2827",81018141,"Da Kath & Kim Code","82 min","Movies","Kath and Kel's union is tested by Michael Bublé, daughter Kim tries pole dancing, pal Sharon finds love online, and a stalker lurks amid Yuletide cheer."
"2828",81015524,"Kath & Kimderella","86 min","Comedies","Chipper baby boomer Kath, diva daughter Kim and hapless pal Sharon visit Papilloma, Italy, where a royal romance and knockoff fashions await."
"2829",70124965,"The Company Men","105 min","Dramas, Independent Movies","A successful businessman comes face-to-face with America's downsizing epidemic when he loses his job and is forced to take a construction gig."
"2830",80999107,"The Flying Guillotine","101 min","Action & Adventure, Dramas, International Movies","In Qing-dynasty China, the emperor commands that a weapon be invented to kill at a distance without a trace. Then he orders it used on its wielders."
"2831",80992365,"The Mansion","100 min","Comedies, Horror Movies, International Movies","A group of students celebrates New Year's at a remote Belgian estate, where their substance-fueled revelry soon descends into a bloodstained nightmare."
"2833",80195835,"Diana: 7 Days That Shook the World","93 min","Documentaries","This illuminating documentary examines the aftermath of Princess Diana’s tragic death and the tense, dramatic week leading up to her funeral."
"2834",80171022,"The Incredible Jessica James","84 min","Comedies, Independent Movies, Romantic Movies","Burned by a bad breakup, a struggling New York City playwright makes an unlikely connection with a divorced app designer she meets on a blind date."
"2835",80192135,"Coco y Raulito: Carrusel de ternura","57 min","Stand-Up Comedy","A study in contrasts, comedy partners and good friends Coco Celis and Raúl Meneses alternate separate stand-up sets for double the laughs."
"2836",80236421,"Extinction","95 min","Action & Adventure, Dramas, Sci-Fi & Fantasy","Plagued by dreams of an alien invasion, a family man faces his worst nightmare when an extraterrestrial force begins exterminating Earth's inhabitants."
"2840",81092331,"1st Summoning","94 min","Horror Movies, Independent Movies","Student filmmakers uncover occult rituals tied to an abandoned warehouse, then gradually realize the horror is closer than they think."
"2841",80173485,"Boi","111 min","Dramas, Independent Movies, International Movies","A young chauffeur who's at a crossroads in his life escorts a pair of clients around Barcelona and becomes embroiled in their mysterious quest."
"2842",81028404,"Eerie","100 min","Horror Movies, International Movies","When a student's suicide rattles an all-girls Catholic school, a clairvoyant guidance counselor leans on a ghost to uncover the convent's abusive past."
"2844",80198508,"Girls With Balls","77 min","Comedies, Horror Movies, International Movies","Stranded in the woods and eyeballed by twisted hunters, members of a women’s volleyball team bump it up in the most dangerous game of their lives."
"2845",80228239,"Guy Martin: Last Flight of the Vulcan Bomber","57 min","Documentaries, International Movies","Guy Martin assists in preparing the last airworthy Vulcan bomber for a farewell tour while revealing the stories behind the iconic aircraft."
"2850",80155932,"The Exception","107 min","Dramas, Romantic Movies","During World War II, a Nazi officer charged with protecting an exiled Kaiser Wilhelm II from spies begins a steamy affair with a secretive Dutch maid."
"2851",80994020,"The Son","93 min","Dramas, Independent Movies, International Movies","In this psychological thriller, painter Lorenzo's life spirals out of control as he fears his wife is trying to isolate him from their infant son."
"2852",80049094,"Amy","128 min","Documentaries, International Movies, Music & Musicals","Rare home videos and interviews with Amy Winehouse's inner circle offer an intimate look at her journey from charismatic teen to troubled star."
"2853",80049177,"Barely Lethal","99 min","Action & Adventure, Comedies","A girl raised to be a government assassin just wants to be a normal teen – so she runs away and pretends to be a high school exchange student."
"2854",80025495,"Dark Places","113 min","Dramas, International Movies, Thrillers","Years after surviving a brutal crime as a child, Libby Day comes to believe that the brother she testified against for committing it may be innocent."
"2855",80023689,"Ex Machina","108 min","Dramas, Independent Movies, International Movies","A coder at a tech company wins a week-long retreat at the compound of his company's CEO, where he's tasked with testing a new artificial intelligence."
"2856",70278930,"Man of Tai Chi","105 min","Action & Adventure, Dramas","In this kung fu tale set in Beijing, a young man armed with incomparable martial arts skills gets embroiled in the world of underground fight clubs."
"2857",80038337,"Mississippi Grind","109 min","Dramas, Independent Movies","A gambler mired in debt thinks another cardsharp may just be his good luck charm as the two head for New Orleans to buy into a high-stakes poker game."
"2858",80053475,"Mojave","93 min","Dramas, Independent Movies, Thrillers","A lethal game of cat and mouse stretches from the desert to Tinseltown after Hollywood bad boy Thomas runs afoul of a cunning and dangerous drifter."
"2859",80999986,"Pahuyut Fighting Beat","82 min","Action & Adventure, International Movies","When profit-seekers threaten to take over a bar in a tourist town, local martial artists put their skills to the test and fight back."
